{
  "$schema": "./tonyAllenPatterns.schema.json",
  "schemaVersion": 1,
  "title": "Tony Allen\u2013style percussion grids (derived from lvm/tidal-drum-patterns)",
  "generatedFrom": "https://raw.githubusercontent.com/lvm/tidal-drum-patterns/master",
  "meta": {
    "description": "kick/snare/hiHat/bell/conga \u2014 one bar, 16 steps per voice (16th-note grid)",
    "sources": {
      "straight": "Sound/Tidal/Drum/Rock1a.hs",
      "swing": "Sound/Tidal/Drum/Swing3a.hs",
      "afrobeat": "Sound/Tidal/Drum/Afro2a.hs"
    },
    "afrobeatBell": "Afro2a.hs has no bell pattern in upstream repo; afrobeat bell row is hand-authored quarter-note cowbell/agogo at steps 0,4,8,12 (see extractTonyAllenPatterns.py)."
  },
  "feels": {
    "straight": {
      "kick": [
        1,
        0,
        0,
        0,
        0,
        0,
        1,
        0,
        1,
        0,
        0,
        0,
        0,
        0,
        0,
        0
      ],
      "snare": [
        0,
        0,
        0,
        0,
        1,
        0,
        0,
        0,
        0,
        0,
        0,
        0,
        1,
        0,
        0,
        0
      ],
      "hiHat": [
        1,
        0,
        0,
        0,
        1,
        0,
        0,
        0,
        1,
        0,
        0,
        0,
        1,
        0,
        0,
        0
      ],
      "bell": [
        0,
        0,
        0,
        0,
        1,
        0,
        0,
        0,
        0,
        0,
        0,
        0,
        1,
        0,
        0,
        0
      ],
      "conga": [
        0,
        0,
        0,
        0,
        0,
        0,
        0,
        0,
        0,
        0,
        0,
        0,
        0,
        0,
        0,
        0
      ]
    },
    "swing": {
      "kick": [
        1,
        0,
        0,
        1,
        0,
        0,
        1,
        0,
        0,
        1,
        0,
        0,
        0,
        0,
        0,
        0
      ],
      "snare": [
        0,
        1,
        1,
        0,
        0,
        0,
        0,
        1,
        1,
        0,
        0,
        0,
        0,
        0,
        0,
        0
      ],
      "hiHat": [
        1,
        0,
        0,
        1,
        0,
        0,
        1,
        0,
        0,
        1,
        0,
        0,
        0,
        0,
        0,
        0
      ],
      "bell": [
        1,
        0,
        0,
        1,
        0,
        0,
        1,
        0,
        0,
        1,
        0,
        0,
        0,
        0,
        0,
        0
      ],
      "conga": [
        0,
        0,
        0,
        0,
        1,
        1,
        0,
        0,
        0,
        0,
        1,
        1,
        0,
        0,
        0,
        0
      ]
    },
    "afrobeat": {
      "kick": [
        1,
        0,
        0,
        0,
        0,
        0,
        0,
        0,
        1,
        0,
        0,
        0,
        0,
        0,
        0,
        0
      ],
      "snare": [
        0,
        0,
        0,
        1,
        0,
        0,
        1,
        0,
        0,
        0,
        0,
        0,
        0,
        0,
        0,
        0
      ],
      "hiHat": [
        1,
        0,
        1,
        1,
        1,
        0,
        1,
        0,
        1,
        0,
        1,
        0,
        1,
        0,
        1,
        0
      ],
      "bell": [
        1,
        0,
        0,
        0,
        1,
        0,
        0,
        0,
        1,
        0,
        0,
        0,
        1,
        0,
        0,
        0
      ],
      "conga": [
        0,
        0,
        0,
        0,
        0,
        0,
        0,
        0,
        0,
        0,
        1,
        0,
        1,
        0,
        1,
        0
      ]
    }
  }
}
